category,metric,description
saas,time-to-value ,"Time-to-value: This metric measures the amount of time it takes for a customer to realize the expected benefits and ROI of the SaaS implementation, application modernization, cloud migration, or business transformation project. This metric is important because it directly affects customer satisfaction and retention."
saas,adoption-rate,"Adoption rate: This metric measures the percentage of users or stakeholders who have adopted the new SaaS solution, modernized application, migrated to the cloud, or transformed their business processes. High adoption rates indicate that the customer is deriving value from the solution and is more likely to renew their subscription or contract."
saas,user-engagement,User engagement: This metric measures how frequently and actively users are using the new SaaS solution or modernized application. High engagement rates indicate that users are finding the solution valuable and are more likely to continue using it.
saas,customer-satisaction,"Customer satisfaction: This metric measures how satisfied the customer is with the SaaS implementation, application modernization, cloud migration, or business transformation project. Customer satisfaction can be measured through surveys, net promoter score (NPS), or customer reviews."
saas,churn-rate,Churn rate: This metric measures the percentage of customers who cancel their subscription or contract. A high churn rate indicates that the customer is not deriving value from the solution or is dissatisfied with the service.
saas,cost-savings,"Cost savings or revenue growth: This metric measures the amount of cost savings or revenue growth achieved as a result of the SaaS implementation, application modernization, cloud migration, or business transformation project. This metric is important because it demonstrates the tangible benefits of the solution and justifies the customer's investment."
saas,time-and-resource-efficiency,"Time and resource efficiency: This metric measures how much time and resources were saved as a result of the SaaS implementation, application modernization, cloud migration, or business transformation project. This metric is important because it demonstrates the efficiency gains achieved through the solution and justifies the customer's investment."
app modernisation,app-performance,"Application performance improvement: This metric measures the improvement in the performance of the application after modernization. It could be measured in terms of faster response times, higher throughput, or reduced downtime. High application performance is critical for customer satisfaction and productivity."
app modernisation,reduction-in-tech-debt,"Reduction in technical debt: Technical debt refers to the accumulated cost of maintaining and updating outdated software systems. Modernizing applications can help reduce technical debt, leading to more efficient and cost-effective operations. Measuring the reduction in technical debt is a key success metric for application modernization."
app modernisation,improved-security,Improved security and compliance: Modernizing applications can help improve security and compliance by implementing the latest security protocols and compliance standards. Measuring the reduction in security vulnerabilities or compliance violations is an important success metric for application modernization.
app modernisation,user-adoption,"User adoption and satisfaction: Application modernization should ultimately lead to a better user experience for employees or customers. Measuring user adoption and satisfaction through surveys, usage statistics, or feedback is a key success metric for application modernization."
app modernisation,scalability-agility,"Scalability and agility: Application modernization can help make applications more scalable and agile, enabling them to handle more users, transactions, or data. Measuring the increase in scalability or agility is an important success metric for application modernization."
app modernisation,cost-savings,"Cost savings: Application modernization can help reduce costs by optimizing resources, reducing manual processes, or leveraging cloud computing. Measuring the cost savings achieved through application modernization is a key success metric."
app modernisation,time-to-maret,"Time-to-market: Application modernization can help reduce the time it takes to bring new features or products to market. Measuring the decrease in time-to-market is an important success metric for application modernization, as it can help improve competitiveness and customer satisfaction."
cloud migration,app-availability,Application availability: Cloud migration should ensure that the application is available to customers or employees at all times. Measuring application availability through uptime statistics or user feedback is an important success metric for cloud migration.
cloud migration,scalability-agility,"Scalability: Cloud migration should enable applications to scale up or down based on demand. Measuring the increase in scalability or ability to handle more users, transactions, or data is an important success metric for cloud migration."
cloud migration,cost-savings,"Cost savings: Cloud migration should help reduce costs by optimizing resources, reducing manual processes, or leveraging cloud computing. Measuring the cost savings achieved through cloud migration is a key success metric."
cloud migration,security-compliance,Security and compliance: Cloud migration should help improve security and compliance by implementing the latest security protocols and compliance standards. Measuring the reduction in security vulnerabilities or compliance violations is an important success metric for cloud migration.
cloud migration,user-adoption,"User adoption and satisfaction: Cloud migration should ultimately lead to a better user experience for employees or customers. Measuring user adoption and satisfaction through surveys, usage statistics, or feedback is a key success metric for cloud migration."
cloud migration,time-to-market,"Time-to-market: Cloud migration should help reduce the time it takes to bring new features or products to market. Measuring the decrease in time-to-market is an important success metric for cloud migration, as it can help improve competitiveness and customer satisfaction."
cloud migration,roi,"ROI: Cloud migration should ultimately deliver a return on investment. Measuring the ROI through cost savings, revenue growth, or productivity gains is an important success metric for cloud migration."
business transformation,revenue-growth,Revenue growth: One of the primary goals of a sales business transformation programme is to drive revenue growth. Measuring the increase in revenue achieved through the programme is a key success metric.
business transformation,sales-pipeline,"Sales pipeline velocity: Sales pipeline velocity measures the speed at which leads move through the sales pipeline. Improving pipeline velocity is a key objective of sales business transformation programmes, and measuring the increase in pipeline velocity is an important success metric."
business transformation,conversion-rates,Conversion rates: A successful sales business transformation programme should improve conversion rates at all stages of the sales funnel. Measuring the increase in conversion rates is a key success metric.
business transformation,customer-acquistion-cost,Customer acquisition cost (CAC): Reducing customer acquisition costs is a key objective of sales business transformation programmes. Measuring the decrease in CAC is an important success metric.
business transformation,customer-retention,Customer retention rate: A successful sales business transformation programme should also improve customer retention rates. Measuring the increase in customer retention rates is an important success metric.
business transformation,sales-cycle,Sales cycle length: Reducing the length of the sales cycle is another objective of sales business transformation programmes. Measuring the decrease in the length of the sales cycle is an important success metric.
business transformation,roi,"ROI: A sales business transformation programme should ultimately deliver a return on investment. Measuring the ROI through cost savings, revenue growth, or productivity gains is an important success metric for the programme."
,,